phrase,ref
Because the internet penetration in Ghana is not that huge.,mixed
And basically we would want people to know about us.,mixed
We have to go to places where people will be comfortable with us.,external
"Then when they come in that capacity, it'll become very easy for them to use our services.",mixed
"So for me, I think that is a very good achievement as a business to not to only look at the profitability side, but to look at the overall impact it will have on the entire business as a whole.",internal
You're welcome.,mixed
"Okay, thank you for your question.",mixed
"So for me, decision making as a manager is one of the most challenging activities or challenging responsibilities on your decks because if you don't create room for people to come up with ideas or if you don't create room for dialogue to be made or collaboration be made, it always makes you fixated to something that is a cake, something that is rigid, something that makes it very, very difficult for your people or team members to adjust or play their part in implementing the decision after it's been made because, uh, there is a saying that, idea is not in one month's head rise.",external
"And the youth, there's also another saying that the, the young ones are the one full of ideas.",external
"So if you open that room for people to make, definitely in the business sector, the final decision has to come, come from the manager, right?",external
Or the final decision has to come from the board.,external
"But if you give room for people to also come up with ideas and that decision is being made and you credit the people that came up with ideas, it helps to foster that coordination, that collaboration in the business.",external
And it helps people to appreciate what their input that they are bringing to the table.,external
And they tend to to stay longer and give more and better results for the company.,mixed
"So for me, out all my decisions that I make in the company, I always make sure that I have my team involved.",external
"It's not a one month thing, it's a collaborating thing.",external
Then we do it and we do it together to achieve the resource that we want.,external
We have quite a number of partnerships because sometimes we provide PS on our platform to motivate hardworking drivers.,mixed
And also sometimes we provide ps for let me say truthful passengers.,mixed
"For example there's a passenger that, no, for truthful drivers, there's a driver that someone left huge sums of money in his car and he returned it.",mixed
"But if it had been somebody who tried to be corny and run away with the money, it would take some time for us to get him.",mixed
And we also provide insurance.,mixed
We work with insurance companies to provide some insurance packages for the drivers.,mixed
We also work with a network company.,mixed
"I think before July, 2024, we signed the biggest network company in Ghana, um, to provide some data services for our drivers, which they started implementing in September, which is actually a good thing.",mixed
"So you can, no one is an airline.",mixed
"You can't do everything on your own, no matter what.",external
We also have partnership with some four stations.,mixed
We provide four vouchers.,mixed
"Uh, we have a partnership with one, uh, maintenance comment, car maintenance shop in AC garage, which helps our top performing drivers to service their cars and maintain their tires and those things.",mixed
We definitely would need services from people and it is always good for businesses to bond and do business together.,mixed
Okay.,mixed
Thank you for your question.,mixed
"So when it comes to information dissemination, I think with my company, I think in the beginning of our conversation, I made mention of the fact that we don't entertain corporate bullshit.",internal
Not to say that we don't have a procedure or a proper way of communication in our company.,mixed
We do have a proper way of com communication in our company.,mixed
"We use an internal communication platform called ""We"".",mixed
"We do have access to corporate emails and other stuff, but it's an internal communication to call Slack.",mixed
"Where each one has particular channels, particular groups, there are channels for general manager.",mixed
"There are channels for managers, there are channels for the executive board.",mixed
"There are channels for project managers, operation managers, uh, customer support managers, like all these channels are there where we communicate, we tag people that are responsible for particular jobs and other stuff.",mixed
But I have people that supervise me.,mixed
"If I want to communicate anything to my bosses, there's nothing that can't stop me from channeling my ideas or asking them question about anything that there is that openness in our, in my company.",mixed
"Because you are not allowed to restrict someone from making their point because no one knows the reason, the reason why as a company, we stand with this with distance is because one of our verticals that we are operating, I think the business operates in 150 countries, started by someone who was lower in the rank.",mixed
"It was his idea that brought up that vertical and it was being worked on and became bigger and bigger, started generating more revenue than even the oldest vertical.",mixed
Like it started generating almost half of the revenue in the oldest vertical the business was generating.,mixed
So our communication is open.,mixed
"You talk to your, you talk to, there is that proper feedback system we have.",mixed
"We do reviews of performances, we do reviews of attacks, all those things.",mixed
"And people, whenever there are issues or there are conflicts, we find the best way to resolve this conflict.",mixed
"And as so far as we are, we are humans.",mixed
There will be one or two issues of people having one or two misunderstandings with a colleague or with a workmate.,mixed
"And we find out the best way to resolve this and not to make these people have hidden hate within, within the team to affect the overall team performance.",mixed
I get what you're saying.,mixed
"Yeah, yeah, sure.",mixed
"I think I've worked a number of jobs as a person, I started after uni, I started as a teacher.",mixed
"I did some freelance job, uh, personally as an IT support, like I was moving around supporting people, people who needed my services.",mixed
Then I worked with the mining servicing company for six months before I moved into the tech industry proper.,mixed
"So I would say from the mining services company, after that I've been with my company for six years.",mixed
"So the mining services company, the only difference I see is with the mining services company, they are using a traditional approach.",mixed
"If your boss says this, you cannot say the otherwise.",external
You understand.,mixed
"If your boss says, you cannot even chip in your idea what you think, because the whole perception is you are just fresh from school, you don't really have any sort of experience.",external
"You're not supposed to be the one to question my idea or you're not supposed to be the one, don't object.",mixed
"What I come up with, just follow the rules and do your work.",internal
Right.,mixed
"In the bias servicing company, you are supposed to dress in a particular way, always you look like, uh, I don't know how to put it, but with my current job, I can just put my t-shirts, I can even put on, um, cam shoes and come to work.",mixed
"I when I come to work, I can take my sneaker off and put on my Crocs and just do my work.",mixed
"Mine is just to do my work, not necessarily how I look or how, and one of the thing I love about my current job is the fact that I work three days in the office, two days in the house.",internal
So that's for me that those things are the major differences why I've come to love working here.,internal
And I would probably would love to keep spending some time here and help them do very well as a business and expand across more cities in Ghana.,internal
So I have a funny story about my probation.,mixed
Okay.,mixed
And I think I would say this as an advice for anyone that will ever go into any business and will be put on probation.,internal
"For me, I think the key thing that managers want to see during probation is someone that is willing to learn.",internal
"Because no matter where I came from, you might have the experience already, but sectors and fuels and companies are different in terms of procedures and protocols and operations.",mixed
Okay?,mixed
Right.,mixed
"So regardless of the principle, the experience you came with, just have that adaptability spirit to adapt to the system that you were in.",external
"When I joined my company, I joined with one guy.",mixed
"He was, you know, in Ghana, uh, people consider that people from asasi to be brighter than any because of the structure of learning and the kind of lecturers they have in their school.",mixed
So I joined with one guy from Asasi.,mixed
"He was, I think he was, let me say he was ranked higher than me because of the university he was coming from.",mixed
"But that guy didn't have the desire and the energy, the hunger and the test that I had or the passion I had for the work.",internal
"Because although I came from the IT field, I was new to data analytics, if you understand.",mixed
"And how quick I was able to adapt, adapt and adapt to the business goals and the business metrics and those things.",external
"And how I was able to understand the connectivity of these metrics and the things that I'm supposed to do to, if A is misbehaving, things I'm supposed to do with B to make sure it's part A, if C'S misbehaving what I'm supposed to do to part A.",mixed
"And those things, at that time the business was going through some kind of rough patch, but I believe it was those things that made them realize that no, regardless of the the struggles that we are going through, this guy is more hungry for success and we have to give him the chance to stay and also help him to become better.",external
"So for me, probation, the most important thing is let the organization see that willingness to learn and that spirit of adaptability and let them see that, that design, passion, passion you spoke about during your interview.",external
"Yeah, sure.",mixed
"Mentorship, but even as I'm sitting here, I like, I still need ten more mentors.",mixed
"Mentorship, mentorship is very, very important because in as much as we as people, we always say that make your own mistakes and learn from them.",external
It's always best to know someone's mistake and learn from learn from that mistake.,external
"It makes it shorter and simpler because we don't have time, we think we have time in this life, we don't have that much time.",mixed
"By the time you will be done making your mistakes and learning from them, time would've been far spent, far gone.",mixed
And you will not be able to achieve what you would want to achieve.,mixed
"So mentorship is important for me, I'll keep on looking for more mentors, people that can help me, guide me, and who will motivate me to become a better version of myself.",external
And I would love to mentor people.,external
"My doors are always open for other people, black people to come, so that I can also share what I've learned and the knowledge I've gained.",external
"So far, but, I still have some people I mentor when it comes to work and when it comes to, let me say, public Christian life.",mixed
So that is it when it comes to mentorship.,mixed
"Okay, thank you for your question.",mixed
"So when it comes to motivation, I would say that family is my motivation in everything that I do because when I wake up in the morning, I look at my wife's face, uh, it motivates me.",external
"I look at my kids' face, it motivates me because basically I need to feed them.",external
I need to take care of the home.,external
"I need to take care of my extended family: my dad, my mom, my sisters.",external
"Uh, I didn't come alone in this life.",external
"So always there are people, people I look up to, to draw energy from, to draw enthusiasm from.",external
"But for me, I think I always would want to, I always say that sometimes with motivation it diminishes.",mixed
"So I always try my best to keep that spirit of discipline because discipline is more of like, uh, it's like if you're able to develop that discipline, it's like cocaine.",mixed
You can't stop.,mixed
"Like it's always, it is always flaming in you, when you want to get, you have to do.",internal
"And when it comes to challenges at work, when I joined my visit, my company had understand, I think I had, at that point in time, I had not learned how to, how to withstand challenges.",internal
"And whenever we are in turbulence, I start to panic and I start to, I start to pass on the negative energy onto subordinate advice.",external
"So at the point I started learning from that, and at the moment I think I can, I can probably say that, uh, I've learned how to become calm.",internal
I've learned how to understand that everything that happens will pass.,internal
Like it's just for a particular moment.,mixed
"Like those things are faces, like it will pass.",mixed
"'cause during covid time we went down, like, much like our projection went down.",mixed
"Like there was lockdown, businesses were closing down, like things worked out and nothing was happening.",mixed
"And we were, I was scared.",internal
"Like I wasn't really, really scared for myself because I felt that if even if the company sinks, with the lot of experience that I have, I might get a different job if things become normal.",internal
"But I was scared for the new guys that had entered like the fresh people, that had put their trust in me for me to help them grow and for me to help them push them to the higher heights.",external
"And all of a sudden, my idea came in mind and we created a protected category in Ghana for the first time, and people like bounced to the idea and our members started jumping and growing and growing and growing.",mixed
So those moments taught me very important message in life that sometimes you just have to be calm.,internal
If you're a Christian you just have to pray because God actually is the give off ideas and knowledge.,mixed
"So for me, challenges shouldn't be something to make you fold and make you make you slow down.",internal
"It's a pleasure to talking to you, Mr.",mixed
I'm good.,internal
You?,mixed
"So actually, thank you for having me.",mixed
"Yeah, sure.",mixed
"So, you know, my name is M.B. Shtiak and I am from Australia, Sydney, Australia.",mixed
And I lived in Bangladesh last five years.,mixed
I used to work in human resources.	,mixed
I worked with multinational companies and international development organizations before.,mixed
"And in Australia, I'm actually pursuing my masters right now.",mixed
I doing a master of business management at Central Queensland University.,mixed
"And also, I'm working in a retail shop as a retail associate.",mixed
Okay okay.,mixed
Uh before that.,mixed
Yeah.,mixed
So in Australia my work is a retail associate which i've just told you and before that.,mixed
"Yes, I have worked near about five years in human resources and my last job was with a multinational company and that was genpa Bangladesh, it's a subsidiary of Julpa UAE that's one of UAE's largest producer and exporter of medicines and before that I worked with Friendship International, an international development organization.",mixed
"I worked there for about three years so altogether my work experience in human resources is five years, a little bit more than five years.",mixed
And yeah.,mixed
"Yeah, so I've actually worked in two different work setups because before I moved to Australia, I've never worked in retail.",mixed
Retail is totally different than what I used to do in Bangladesh because that was like nine to five corporate job.,mixed
That was like a desk job but in Australia it's like a retail job.,mixed
So uh that was quite new for me because i've never worked in retail before and if you ask me about work culture difference i wouldn't be able to describe an official setup in Australia because I didn't work in an office setup in Australia yet so I'm yet to experience that.,internal
"But in retail, it's very fast paced.",mixed
"And the thing is you have to work in a team, of course.",mixed
And that's quite similar to how we used to work in Bangladesh as well.,mixed
"I mean, you have to work in teams and also work culture is like in Bangladesh, people are more emotional and here people are more practical.",mixed
"So also there's another significant difference that I have noticed so far is in Bangladesh, some local organizations, fortunately, I didn't have to work with a lot of local organizations, I worked with like multinationals and INGOs.",internal
But I have had friends who have worked with like local organizations.,mixed
"And there it was, it was something like when you ask for a leave and your employer, they don't seem to be very happy about it, even though you are entitled to take leaves, like sick leaves, casual leaves, whatever.",mixed
So this is a significant change here in Australia.,mixed
"So, yeah, these are a few significant changes that I have noticed so far.",internal
Okay.,mixed
So i'll give you a very practical answer to that because a lot of fabricated answers would sound like so I love to help people and all for me.,internal
"Actually because I have been working human resources before I love to work with people, I love helping people and even though I have never worked in retail, this kind of job, working in retail, it requires you to be a very good communicator.",internal
And also you have to be able to help people.,external
"Because in retail, what happens, when someone comes to your store, they're actually looking for something.",mixed
So you are there to help them make that purchase decision or make suggestions based on their needs.,internal
That's what I enjoy about my job.,internal
"That would be a very generalized answer but in addition to that since i was new to a retail sector and for the first week I didn't even think that I could survive the retail environment, because I moved to Australia from a different country, and some people from eastern suburbs have a distinct accent which I was having like a really hard time trying to understand.",internal
"But eventually after a week, I actually started to get their accent, started to understand what they're trying to say.",mixed
And I started to communicate well.,mixed
"What excites me most about my job is if the store makes the budget, I mean like daily budget and then we have a weekly budget and then a monthly budget, if the store makes budget you get bonus so for me it's like entirely money.",external
"Money motivates me because I'm an international student here and I have a lot of bills to pay, I have to save for my university as well, so expenses as well tuition fees etc etc.",external
"I have to pay like every kind of bills that I have, so for me if I do well in my job that means I'll get some bonus at the end of the month.",external
"So doing well in my job is not an option for me, that's what I strive to do because I know a lot of people will give you a different answer, but for me money is the biggest motivator.",external
"So it motivates me, that's what actually excites me about my job.",external
Valuable lessons?,mixed
Yeah.,mixed
Okay.,mixed
So that should be never to take anything to heart because I have had very difficult customer who would make some racist comments.,internal
"Also, I've had really good customers at the same time most of my customers are really good.",mixed
"The one valuable lesson that I learned from my job is to let go of whatever is bothering you, you have to let it go.",internal
If you let it ruin your day what will happen that you will lack in performance.,external
"And if you lack in performance, you will not be able to make the budget.",mixed
"So you will still get your salary, of course, but you will not get the bonus that you need to pay a lot of your bills, so for me it's not an option.",internal
For me the valuable lesson is to let go and never take like anything too hard.,internal
Yeah that's what I learned.,mixed
So we are a team of four people in our shop right now.,mixed
"But the thing is even though we are a team, most of the time we work alone because of the store hour.",mixed
We have limited store hours so most of the time we are working by ourselves.,mixed
"But sometimes there are crossovers and for two-three hours we get to work together with another team member, that's at max two people at the same time.",mixed
You compliment each other and you cooperate with each other and especially during rush hour like Christmas season.,mixed
"So if your team performs well and if you are cooperating and communicating well with your team, it gets a lot easier.",mixed
So I'm actually very flexible in terms of working with a team or working by myself.,mixed
Most of the times I work by myself.,mixed
"All right, so I wouldn't say that conflict never happens in my work.",internal
So I have had a fair share of conflicts before and in my current job as well.,mixed
For example I wouldn't say it was a very difficult kind of conflict but sometimes I go extra mile so that my store performs well.,external
"So sometimes when we close at night at around like 9, 10, as it is like high season now, so whenever some other team member closes, they do not always leave the store very tidy.",mixed
They have to do cleanings.,mixed
They have to do all sort of works.,mixed
So it's really difficult.,mixed
"If the last person closing the last night doesn't eave the store tidy, clean and organized, it's very difficult for the next person who comes in to open.",mixed
Okay.,mixed
I had some sort of disagreement with one of my colleagues.,mixed
Work-life balance is simple: you have to have a healthy lifestyle and also you got to work because without work how are you going to pay your bills.,mixed
Right.,mixed
I know my next week's plan because the roaster has been published prior to a week.,mixed
"At least we know what am I going to do forthe next one week and when am I working and when am I not, and when do I have classes, and when do I have exams.",internal
"So I try to manage my time based on that and on weekends I, sometimes like to go to the beach, take a dive into the ocean or hang out with my friends, go to movies, or i love to read a lot of books.",mixed
I carry books with me like everywhere.,mixed
So that's what I do.,mixed
And also sometimes I talk to my parents back at home and my friends.,mixed
"And my friends overseas, I talk to them sometimes.",mixed
I try to stay connected to everyone.,mixed
"That's how I sort of try to  balance my work and life so that I have a social life, I have personal time for myself, and also I have enough time to study and work.",mixed
Okay.,mixed
So I can actually give you an answer in two different ways.,mixed
"From my prior experience experience in human resources, that's what I can do, give you an answer from that perspective and my present perspective.",mixed
"I'll try to blend and give you one simple answer, okay?",mixed
So for someone who's wanting to start their career my suggestion is be bold and also don't be scared of anything.,mixed
When i started working in retail I had zero experience in retail.,mixed
Actually I always have been very good with interviews because I took a lot of interviews in my life.,mixed
So I know what sort of questions are being asked in interview.,mixed
So I was always good at interview and I did well in my interview.,internal
"But when I got the job for retail associate and in my first day at work, I had such cold feet.",internal
"And I was not understanding anyone's accent, like the people of the shire have a different kind of accent, they use a lot of acronyms that I'm not familiar with).",mixed
When I started working in retail I started to doubt.,internal
"Thank you so much, Mr. Ghosh, for having me in your session i hope it helps.",mixed
If you need any further assistance or support regarding whatever queries you might have feel free to write to me.,external
thank you so much for having me.,mixed
Thank you.,mixed
Have a nice rest of the day.,mixed
Bye.,mixed
Okay.,mixed
Great.,mixed
"Hi, everyone.",mixed
"Uh, my name is Farhad.",mixed
"Uh, my last name is Yuldashev.",mixed
"I am deputy Station manager of Uzbekistan Airways in the Russian Federation, based in Moscow.",mixed
"Do I have to describe my position, what I have to do here?",mixed
"Okay, great.",mixed
"Uh, my position is, actually we are responsible for all the regular flights and charter flights, which operate to the Russian Federation.",mixed
And actually we're responsible just for operating flights.,mixed
"The technical, all the technical issues, any questions from passengers.",mixed
We’re responsible for it.,mixed
Actually I like aviation.,internal
"So, to work overseas, it's the best experience for, I think, for everyone.",internal
"So in this case, for me, also, but, the difficulties is, this is foreign country.",internal
"This is not my native country, so that's why it's a little bit difficult to live in another country, not in native country.",internal
And for my family also.,mixed
This is a difficulty.,mixed
"The, the biggest difficulty is this.",mixed
"Uh, sorry?",mixed
"Uh, a little bit, yeah.",mixed
A little.,mixed
"Actually, it's not pointed just in Russia, it's pointed overseas.",mixed
Uzbekistan is native country.,mixed
I'm like a fish in the sea in Uzbekistan.,internal
So that's why it's better to be in Uzbekistan.,mixed
"But for experience, it's a good opportunity to work overseas.",mixed
"Uh, the main motivation is to improve my skills, to improve my working skills, to get more experience.",internal
This motivates me.,external
